{
  "schema_version": "iraqi_legal_document.v2",
  "created_at": "2026-08-15T18:18:19.136306+00:00",
  "source": {
    "filename": "قرار توصية الاقتصاد تعديل سعر منتوجي زيت الوقود وزيت الغاز.docx",
    "extension": ".docx",
    "parser": "legal_document_parser",
    "encoding": "utf-8"
  },
  "document": {
    "title": "قــرار مجلــس الــوزراء",
    "type": "قرار مجلس الوزراء",
    "decision_number": null,
    "year": "2024",
    "issue_date": "30/10/2024",
    "session_number": "الرابعة والاربعين",
    "session_date": "29/10/2024"
  },
  "metadata": {
    "source_filename": "قرار توصية الاقتصاد تعديل سعر منتوجي زيت الوقود وزيت الغاز.docx",
    "source_stem": "قرار توصية الاقتصاد تعديل سعر منتوجي زيت الوقود وزيت الغاز",
    "title": "قــرار مجلــس الــوزراء",
    "document_type": "قرار مجلس الوزراء",
    "decision_number": null,
    "year": "2024",
    "issue_date": "30/10/2024",
    "session_number": "الرابعة والاربعين",
    "session_date": "29/10/2024",
    "subject": null,
    "sender": null,
    "recipient": null,
    "signature": {
      "name": "د. حميــد نعيــم الغــزي",
      "title": "الأميـن العـام لمجلـس الـوزراء",
      "date": "30/10/2024"
    },
    "source_character_count": 582,
    "source_paragraph_count": 10
  },
  "references": [
    {
      "type": "recommendation_number",
      "text": "24315 ق"
    },
    {
      "type": "reference_number",
      "text": "و/623"
    },
    {
      "type": "date_reference",
      "text": "15/8/2024"
    }
  ],
  "decision": {
    "sections": [
      {
        "section_id": "header",
        "title": "header",
        "paragraph_indexes": [
          1,
          2,
          3
        ],
        "text": "قــرار\nمجلــس الــوزراء\nرقــم (                     ) لسنــة 2024"
      },
      {
        "section_id": "signature",
        "title": "signature",
        "paragraph_indexes": [
          8,
          9,
          10
        ],
        "text": "د. حميــد نعيــم الغــزي\nالأميـن العـام لمجلـس الـوزراء\n30/10/2024"
      }
    ],
    "numbered_items": []
  },
  "long_text": "قــرار\nمجلــس الــوزراء\nرقــم (                     ) لسنــة 2024\nقــرّر مجلــس الــوزراء في جلستــه الاعتياديــة الرابعة والاربعين المنعقدة في 29/10/2024 \nإقرار توصية المجلس الوزاري للاقتصاد (24315 ق) ؛ بحسب الآتي:\nالموافقة على تعديل أسعار المنتجات النفطية المجهزة إلى شركة ناقلات النفط العراقية \nالواردة بكتاب وزارة النفط المرقم بالعدد ( و/623 ) المؤرخ في 15/8/2024 لتصبح كالآتي :\nمنتوج زيت الوقود (150.000) دينار / م3 بدلًا من (350.000) دينار / م3 .\nمنتوج زيت الغاز (400) دينار / لتر بدلًا من (750) دينار / لتر .\nد. حميــد نعيــم الغــزي\nالأميـن العـام لمجلـس الـوزراء\n30/10/2024",
  "body": "قــرار\nمجلــس الــوزراء\nرقــم (                     ) لسنــة 2024\nقــرّر مجلــس الــوزراء في جلستــه الاعتياديــة الرابعة والاربعين المنعقدة في 29/10/2024 \nإقرار توصية المجلس الوزاري للاقتصاد (24315 ق) ؛ بحسب الآتي:\nالموافقة على تعديل أسعار المنتجات النفطية المجهزة إلى شركة ناقلات النفط العراقية \nالواردة بكتاب وزارة النفط المرقم بالعدد ( و/623 ) المؤرخ في 15/8/2024 لتصبح كالآتي :\nمنتوج زيت الوقود (150.000) دينار / م3 بدلًا من (350.000) دينار / م3 .\nمنتوج زيت الغاز (400) دينار / لتر بدلًا من (750) دينار / لتر .\nد. حميــد نعيــم الغــزي\nالأميـن العـام لمجلـس الـوزراء\n30/10/2024",
  "paragraphs": [
    {
      "index": 1,
      "text": "قــرار"
    },
    {
      "index": 2,
      "text": "مجلــس الــوزراء"
    },
    {
      "index": 3,
      "text": "رقــم (                     ) لسنــة 2024"
    },
    {
      "index": 4,
      "text": "قــرّر مجلــس الــوزراء في جلستــه الاعتياديــة الرابعة والاربعين المنعقدة في 29/10/2024 \nإقرار توصية المجلس الوزاري للاقتصاد (24315 ق) ؛ بحسب الآتي:"
    },
    {
      "index": 5,
      "text": "الموافقة على تعديل أسعار المنتجات النفطية المجهزة إلى شركة ناقلات النفط العراقية \nالواردة بكتاب وزارة النفط المرقم بالعدد ( و/623 ) المؤرخ في 15/8/2024 لتصبح كالآتي :"
    },
    {
      "index": 6,
      "text": "منتوج زيت الوقود (150.000) دينار / م3 بدلًا من (350.000) دينار / م3 ."
    },
    {
      "index": 7,
      "text": "منتوج زيت الغاز (400) دينار / لتر بدلًا من (750) دينار / لتر ."
    },
    {
      "index": 8,
      "text": "د. حميــد نعيــم الغــزي"
    },
    {
      "index": 9,
      "text": "الأميـن العـام لمجلـس الـوزراء"
    },
    {
      "index": 10,
      "text": "30/10/2024"
    }
  ],
  "legal_entities": {
    "organizations": [
      "المجلس الوزاري للاقتصاد (24315 ق) ؛ بحسب الآتي",
      "شركة ناقلات النفط العراقية",
      "وزارة النفط المرقم بالعدد ( و/623 ) المؤرخ"
    ],
    "companies": [
      "شركة ناقلات النفط العراقية الواردة بكتاب وزارة النفط المرقم بالعدد"
    ],
    "persons": [
      "د. حميــد نعيــم الغــزي"
    ],
    "all": [
      {
        "type": "organization",
        "name": "المجلس الوزاري للاقتصاد (24315 ق) ؛ بحسب الآتي"
      },
      {
        "type": "organization",
        "name": "شركة ناقلات النفط العراقية"
      },
      {
        "type": "organization",
        "name": "وزارة النفط المرقم بالعدد ( و/623 ) المؤرخ"
      },
      {
        "type": "company",
        "name": "شركة ناقلات النفط العراقية الواردة بكتاب وزارة النفط المرقم بالعدد"
      },
      {
        "type": "person",
        "name": "د. حميــد نعيــم الغــزي"
      }
    ]
  },
  "extracted_fields": {
    "document_type": "قرار مجلس الوزراء",
    "decision_number": null,
    "year": "2024",
    "issue_date": "30/10/2024",
    "session_number": "الرابعة والاربعين",
    "session_date": "29/10/2024",
    "subject": null,
    "sender": null,
    "recipient": null,
    "recommendation_numbers": [
      "24315 ق"
    ],
    "reference_numbers": [
      "و/623"
    ],
    "document_numbers": [],
    "numeric_values": [
      {
        "type": "money",
        "text": "(150.000) دينار"
      },
      {
        "type": "money",
        "text": "(350.000) دينار"
      },
      {
        "type": "money",
        "text": "(400) دينار"
      },
      {
        "type": "money",
        "text": "(750) دينار"
      },
      {
        "type": "number",
        "text": "(150.000)"
      },
      {
        "type": "number",
        "text": "(350.000)"
      },
      {
        "type": "number",
        "text": "(400)"
      },
      {
        "type": "number",
        "text": "(750)"
      }
    ],
    "tables": []
  },
  "signature": {
    "name": "د. حميــد نعيــم الغــزي",
    "title": "الأميـن العـام لمجلـس الـوزراء",
    "date": "30/10/2024"
  },
  "extraction_notes": {
    "summarized": false,
    "truncated": false,
    "missing_information_policy": "null",
    "uses_chatbot": false,
    "uses_ollama": false,
    "uses_chromadb": false,
    "uses_postgresql": false
  }
}