{
  "schema_version": "iraqi_legal_document.v2",
  "created_at": "2026-08-15T18:18:19.293567+00:00",
  "source": {
    "filename": "قرار منح الموظفين العاملين مخصصات اشعاع.docx",
    "extension": ".docx",
    "parser": "legal_document_parser",
    "encoding": "utf-8"
  },
  "document": {
    "title": "قــرار مجلــس الــوزراء",
    "type": "قرار مجلس الوزراء",
    "decision_number": null,
    "year": "2024",
    "issue_date": "1/1/2025",
    "session_number": "السابعة والاربعين",
    "session_date": "19/11/2024"
  },
  "metadata": {
    "source_filename": "قرار منح الموظفين العاملين مخصصات اشعاع.docx",
    "source_stem": "قرار منح الموظفين العاملين مخصصات اشعاع",
    "title": "قــرار مجلــس الــوزراء",
    "document_type": "قرار مجلس الوزراء",
    "decision_number": null,
    "year": "2024",
    "issue_date": "1/1/2025",
    "session_number": "السابعة والاربعين",
    "session_date": "19/11/2024",
    "subject": null,
    "sender": null,
    "recipient": null,
    "signature": {
      "name": "د. حميـد نعيـم الغـزي",
      "title": "الأميـن العـام لمجلـس الـوزراء",
      "date": null
    },
    "source_character_count": 1083,
    "source_paragraph_count": 13
  },
  "references": [
    {
      "type": "legal_article",
      "text": "المادة (15) من قانون رواتب موظفي الدولة والقطاع العام (22 لسنة 2008) المعدل على أن لا يزيد مجموع المخصصات الممنوحة على (200%) من الراتب باستثناء"
    },
    {
      "type": "legal_article",
      "text": "المادة (16) من القانون"
    },
    {
      "type": "legal_article",
      "text": "المادة (13) من قانون رواتب موظفي الدولة والقطاع العام (22 لسنة 2008) المعدل وتعليمات الخطـورة المهنيـــة (2 لسنة 2024)"
    },
    {
      "type": "reference_number",
      "text": "د.ا.ف/1/1/10604"
    }
  ],
  "decision": {
    "sections": [
      {
        "section_id": "header",
        "title": "header",
        "paragraph_indexes": [
          1,
          2,
          3
        ],
        "text": "قــرار\nمجلــس الــوزراء\nرقــم (                 ) لسنــة 2024"
      },
      {
        "section_id": "signature",
        "title": "signature",
        "paragraph_indexes": [
          11,
          12,
          13
        ],
        "text": "د. حميـد نعيـم الغـزي\nالأميـن العـام لمجلـس الـوزراء\n/11/2024"
      }
    ],
    "numbered_items": []
  },
  "long_text": "قــرار\nمجلــس الــوزراء\nرقــم (                 ) لسنــة 2024\nبناءً على ما عرضته وزارة الصحة بموجب كتابها المرقـــم بالعــــدد ( د.أ.ف/1/1/10604 ) \nالمـــؤرخ في 28/10/2024.\nقـرر مجلـس الـوزراء فـي جلستـه الاعتياديـــــة السابعـــة والأربعيـن المنعقـدة فـي 19/11/2024 الموافقــــة على ما يأتــي :\nالمسار الأول :\nمنح الموظفين العاملين في حقل الاشعاع مخصصات اشعاع لا تزيد عن (50%) من الراتب \nاستنادًا إلى أحكام المادة (15) من قانون رواتب موظفي الدولة والقطاع العام (22 لسنة 2008) المعدل على أن لا يزيد مجموع المخصصات الممنوحة على (200%) من الراتب باستثناء \nالمخصصات المنصوص عليها في المادتين (14 و 15) استنادًا إلى أحكام المادة (16) من القانون \nالمذكـــور آنفًا .\nالمسار الثاني :\nمنح الموظفيــن العاملين في حقل الاشعاع مخصصات اشعاع مخصصات خطورة مهنية من \nالوزير المختص أو رئيـس اللجنة غير المرتبطة بوزارة بمقدار (30%) من الراتب استنادًا إلى \nأحكام المادة (13) من قانون رواتب موظفي الدولة والقطاع العام (22 لسنة 2008) المعدل وتعليمات الخطـورة المهنيـــة (2 لسنة 2024) .\n2. يُنفــــذ هذا القــــرار بدءًا من تأريــخ 1/1/2025 .\nد. حميـد نعيـم الغـزي\nالأميـن العـام لمجلـس الـوزراء\n/11/2024",
  "body": "قــرار\nمجلــس الــوزراء\nرقــم (                 ) لسنــة 2024\nبناءً على ما عرضته وزارة الصحة بموجب كتابها المرقـــم بالعــــدد ( د.أ.ف/1/1/10604 ) \nالمـــؤرخ في 28/10/2024.\nقـرر مجلـس الـوزراء فـي جلستـه الاعتياديـــــة السابعـــة والأربعيـن المنعقـدة فـي 19/11/2024 الموافقــــة على ما يأتــي :\nالمسار الأول :\nمنح الموظفين العاملين في حقل الاشعاع مخصصات اشعاع لا تزيد عن (50%) من الراتب \nاستنادًا إلى أحكام المادة (15) من قانون رواتب موظفي الدولة والقطاع العام (22 لسنة 2008) المعدل على أن لا يزيد مجموع المخصصات الممنوحة على (200%) من الراتب باستثناء \nالمخصصات المنصوص عليها في المادتين (14 و 15) استنادًا إلى أحكام المادة (16) من القانون \nالمذكـــور آنفًا .\nالمسار الثاني :\nمنح الموظفيــن العاملين في حقل الاشعاع مخصصات اشعاع مخصصات خطورة مهنية من \nالوزير المختص أو رئيـس اللجنة غير المرتبطة بوزارة بمقدار (30%) من الراتب استنادًا إلى \nأحكام المادة (13) من قانون رواتب موظفي الدولة والقطاع العام (22 لسنة 2008) المعدل وتعليمات الخطـورة المهنيـــة (2 لسنة 2024) .\n2. يُنفــــذ هذا القــــرار بدءًا من تأريــخ 1/1/2025 .\nد. حميـد نعيـم الغـزي\nالأميـن العـام لمجلـس الـوزراء\n/11/2024",
  "paragraphs": [
    {
      "index": 1,
      "text": "قــرار"
    },
    {
      "index": 2,
      "text": "مجلــس الــوزراء"
    },
    {
      "index": 3,
      "text": "رقــم (                 ) لسنــة 2024"
    },
    {
      "index": 4,
      "text": "بناءً على ما عرضته وزارة الصحة بموجب كتابها المرقـــم بالعــــدد ( د.أ.ف/1/1/10604 ) \nالمـــؤرخ في 28/10/2024."
    },
    {
      "index": 5,
      "text": "قـرر مجلـس الـوزراء فـي جلستـه الاعتياديـــــة السابعـــة والأربعيـن المنعقـدة فـي 19/11/2024 الموافقــــة على ما يأتــي :"
    },
    {
      "index": 6,
      "text": "المسار الأول :"
    },
    {
      "index": 7,
      "text": "منح الموظفين العاملين في حقل الاشعاع مخصصات اشعاع لا تزيد عن (50%) من الراتب \nاستنادًا إلى أحكام المادة (15) من قانون رواتب موظفي الدولة والقطاع العام (22 لسنة 2008) المعدل على أن لا يزيد مجموع المخصصات الممنوحة على (200%) من الراتب باستثناء \nالمخصصات المنصوص عليها في المادتين (14 و 15) استنادًا إلى أحكام المادة (16) من القانون \nالمذكـــور آنفًا ."
    },
    {
      "index": 8,
      "text": "المسار الثاني :"
    },
    {
      "index": 9,
      "text": "منح الموظفيــن العاملين في حقل الاشعاع مخصصات اشعاع مخصصات خطورة مهنية من \nالوزير المختص أو رئيـس اللجنة غير المرتبطة بوزارة بمقدار (30%) من الراتب استنادًا إلى \nأحكام المادة (13) من قانون رواتب موظفي الدولة والقطاع العام (22 لسنة 2008) المعدل وتعليمات الخطـورة المهنيـــة (2 لسنة 2024) ."
    },
    {
      "index": 10,
      "text": "2. يُنفــــذ هذا القــــرار بدءًا من تأريــخ 1/1/2025 ."
    },
    {
      "index": 11,
      "text": "د. حميـد نعيـم الغـزي"
    },
    {
      "index": 12,
      "text": "الأميـن العـام لمجلـس الـوزراء"
    },
    {
      "index": 13,
      "text": "/11/2024"
    }
  ],
  "legal_entities": {
    "organizations": [
      "وزارة الصحة"
    ],
    "companies": [],
    "persons": [
      "د. حميـد نعيـم الغـزي"
    ],
    "all": [
      {
        "type": "organization",
        "name": "وزارة الصحة"
      },
      {
        "type": "person",
        "name": "د. حميـد نعيـم الغـزي"
      }
    ]
  },
  "extracted_fields": {
    "document_type": "قرار مجلس الوزراء",
    "decision_number": null,
    "year": "2024",
    "issue_date": "1/1/2025",
    "session_number": "السابعة والاربعين",
    "session_date": "19/11/2024",
    "subject": null,
    "sender": null,
    "recipient": null,
    "recommendation_numbers": [],
    "reference_numbers": [
      "د.ا.ف/1/1/10604"
    ],
    "document_numbers": [],
    "numeric_values": [
      {
        "type": "quantity",
        "text": "(15)"
      },
      {
        "type": "quantity",
        "text": "(16)"
      },
      {
        "type": "quantity",
        "text": "(13)"
      }
    ],
    "tables": []
  },
  "signature": {
    "name": "د. حميـد نعيـم الغـزي",
    "title": "الأميـن العـام لمجلـس الـوزراء",
    "date": null
  },
  "extraction_notes": {
    "summarized": false,
    "truncated": false,
    "missing_information_policy": "null",
    "uses_chatbot": false,
    "uses_ollama": false,
    "uses_chromadb": false,
    "uses_postgresql": false
  }
}