{
  "schema_version": "iraqi_legal_document.v2",
  "created_at": "2026-08-15T18:18:19.067631+00:00",
  "source": {
    "filename": "قرار توصية الاقتصاد المشروعاة المستثناة.docx",
    "extension": ".docx",
    "parser": "legal_document_parser",
    "encoding": "utf-8"
  },
  "document": {
    "title": "قــرار مجلــس الــوزراء",
    "type": "قرار مجلس الوزراء",
    "decision_number": null,
    "year": "2024",
    "issue_date": "6/11/2024",
    "session_number": "الخامسة والاربعين",
    "session_date": "5/11/2024"
  },
  "metadata": {
    "source_filename": "قرار توصية الاقتصاد المشروعاة المستثناة.docx",
    "source_stem": "قرار توصية الاقتصاد المشروعاة المستثناة",
    "title": "قــرار مجلــس الــوزراء",
    "document_type": "قرار مجلس الوزراء",
    "decision_number": null,
    "year": "2024",
    "issue_date": "6/11/2024",
    "session_number": "الخامسة والاربعين",
    "session_date": "5/11/2024",
    "subject": null,
    "sender": "تعديل الفقرة ( ثانيًا/2/أ/7) من المحور الثاني من قرار مجلس الوزراء (23374 لسنة 2023) لتصبح كالآتي",
    "recipient": null,
    "signature": {
      "name": "د. حميــد نعيــم الغــزي",
      "title": "الأميـن العـام لمجلـس الـوزراء",
      "date": "6/11/2024"
    },
    "source_character_count": 922,
    "source_paragraph_count": 12
  },
  "references": [
    {
      "type": "cabinet_decision",
      "text": "قرار مجلس الوزراء (23374 لسنة 2023"
    },
    {
      "type": "recommendation_number",
      "text": "24296 ق"
    },
    {
      "type": "reference_number",
      "text": "ق / 10588"
    }
  ],
  "decision": {
    "sections": [
      {
        "section_id": "header",
        "title": "header",
        "paragraph_indexes": [
          1,
          2,
          3
        ],
        "text": "قــرار\nمجلــس الــوزراء\nرقــم (                   ) لسنــة 2024"
      },
      {
        "section_id": "signature",
        "title": "signature",
        "paragraph_indexes": [
          10,
          11,
          12
        ],
        "text": "د. حميــد نعيــم الغــزي\nالأميـن العـام لمجلـس الـوزراء\n6/11/2024"
      }
    ],
    "numbered_items": []
  },
  "long_text": "قــرار\nمجلــس الــوزراء\nرقــم (                   ) لسنــة 2024\nبناءً على ما عرضتـه الهيئة الوطنية للإستثمار بموجب كتابها المرقـــم بالعــــدد ( ق / 10588 ) المـــؤرخ في 11/8/2024 .\nقــرّر مجلــس الــوزراء في جلستــه الاعتياديــة الخامسة والاربعيـن المنعقدة في 5/11/2024 \nإقـــرار توصيـــة المجلس الوزاري للاقتصاد ( 24296 ق ) بحسب الآتي :\nتعديل الفقرة ( ثانيًا/2/أ/7) من المحور الثاني من قرار مجلس الوزراء (23374 لسنة 2023) لتصبح كالآتي :\n}عقود الشراكة المبرمة قبل \" وبعد \" اصدار هذا القرار من الشركات العامة مع القطاع الخاص استنادًا إلى أحكام قانون  الشركات العامة (22 لسنة 1997) المعدل { .\nالغاء الفقرة ( أولًا ) من المحور الثاني / التسهيلات والقروض من قرار مجلس الوزراء المذكور آنفًا ويحل محلها الآتي :\n} يقدم المستثمر خطة تمويل المشروع مشفوعة بتأييد أحد المصارف المجازة مع الأخذ بنظر الاعتبار نسبة انجاز المشروع التي تحددها الهيئة الوطنية للاستثمار { .\nد. حميــد نعيــم الغــزي\nالأميـن العـام لمجلـس الـوزراء\n6/11/2024",
  "body": "قــرار\nمجلــس الــوزراء\nرقــم (                   ) لسنــة 2024\nبناءً على ما عرضتـه الهيئة الوطنية للإستثمار بموجب كتابها المرقـــم بالعــــدد ( ق / 10588 ) المـــؤرخ في 11/8/2024 .\nقــرّر مجلــس الــوزراء في جلستــه الاعتياديــة الخامسة والاربعيـن المنعقدة في 5/11/2024 \nإقـــرار توصيـــة المجلس الوزاري للاقتصاد ( 24296 ق ) بحسب الآتي :\nتعديل الفقرة ( ثانيًا/2/أ/7) من المحور الثاني من قرار مجلس الوزراء (23374 لسنة 2023) لتصبح كالآتي :\n}عقود الشراكة المبرمة قبل \" وبعد \" اصدار هذا القرار من الشركات العامة مع القطاع الخاص استنادًا إلى أحكام قانون  الشركات العامة (22 لسنة 1997) المعدل { .\nالغاء الفقرة ( أولًا ) من المحور الثاني / التسهيلات والقروض من قرار مجلس الوزراء المذكور آنفًا ويحل محلها الآتي :\n} يقدم المستثمر خطة تمويل المشروع مشفوعة بتأييد أحد المصارف المجازة مع الأخذ بنظر الاعتبار نسبة انجاز المشروع التي تحددها الهيئة الوطنية للاستثمار { .\nد. حميــد نعيــم الغــزي\nالأميـن العـام لمجلـس الـوزراء\n6/11/2024",
  "paragraphs": [
    {
      "index": 1,
      "text": "قــرار"
    },
    {
      "index": 2,
      "text": "مجلــس الــوزراء"
    },
    {
      "index": 3,
      "text": "رقــم (                   ) لسنــة 2024"
    },
    {
      "index": 4,
      "text": "بناءً على ما عرضتـه الهيئة الوطنية للإستثمار بموجب كتابها المرقـــم بالعــــدد ( ق / 10588 ) المـــؤرخ في 11/8/2024 ."
    },
    {
      "index": 5,
      "text": "قــرّر مجلــس الــوزراء في جلستــه الاعتياديــة الخامسة والاربعيـن المنعقدة في 5/11/2024 \nإقـــرار توصيـــة المجلس الوزاري للاقتصاد ( 24296 ق ) بحسب الآتي :"
    },
    {
      "index": 6,
      "text": "تعديل الفقرة ( ثانيًا/2/أ/7) من المحور الثاني من قرار مجلس الوزراء (23374 لسنة 2023) لتصبح كالآتي :"
    },
    {
      "index": 7,
      "text": "}عقود الشراكة المبرمة قبل \" وبعد \" اصدار هذا القرار من الشركات العامة مع القطاع الخاص استنادًا إلى أحكام قانون  الشركات العامة (22 لسنة 1997) المعدل { ."
    },
    {
      "index": 8,
      "text": "الغاء الفقرة ( أولًا ) من المحور الثاني / التسهيلات والقروض من قرار مجلس الوزراء المذكور آنفًا ويحل محلها الآتي :"
    },
    {
      "index": 9,
      "text": "} يقدم المستثمر خطة تمويل المشروع مشفوعة بتأييد أحد المصارف المجازة مع الأخذ بنظر الاعتبار نسبة انجاز المشروع التي تحددها الهيئة الوطنية للاستثمار { ."
    },
    {
      "index": 10,
      "text": "د. حميــد نعيــم الغــزي"
    },
    {
      "index": 11,
      "text": "الأميـن العـام لمجلـس الـوزراء"
    },
    {
      "index": 12,
      "text": "6/11/2024"
    }
  ],
  "legal_entities": {
    "organizations": [
      "الهيئة الوطنية للإستثمار",
      "المجلس الوزاري للاقتصاد ( 24296 ق ) بحسب الآتي",
      "مجلس الوزراء (23374 لسنة 2023) لتصبح كالآتي",
      "مجلس الوزراء المذكور آنفًا ويحل محلها الآتي"
    ],
    "companies": [],
    "persons": [
      "د. حميــد نعيــم الغــزي"
    ],
    "all": [
      {
        "type": "organization",
        "name": "الهيئة الوطنية للإستثمار"
      },
      {
        "type": "organization",
        "name": "المجلس الوزاري للاقتصاد ( 24296 ق ) بحسب الآتي"
      },
      {
        "type": "organization",
        "name": "مجلس الوزراء (23374 لسنة 2023) لتصبح كالآتي"
      },
      {
        "type": "organization",
        "name": "مجلس الوزراء المذكور آنفًا ويحل محلها الآتي"
      },
      {
        "type": "person",
        "name": "د. حميــد نعيــم الغــزي"
      }
    ]
  },
  "extracted_fields": {
    "document_type": "قرار مجلس الوزراء",
    "decision_number": null,
    "year": "2024",
    "issue_date": "6/11/2024",
    "session_number": "الخامسة والاربعين",
    "session_date": "5/11/2024",
    "subject": null,
    "sender": "تعديل الفقرة ( ثانيًا/2/أ/7) من المحور الثاني من قرار مجلس الوزراء (23374 لسنة 2023) لتصبح كالآتي",
    "recipient": null,
    "recommendation_numbers": [
      "24296 ق"
    ],
    "reference_numbers": [
      "ق / 10588"
    ],
    "document_numbers": [],
    "numeric_values": [],
    "tables": []
  },
  "signature": {
    "name": "د. حميــد نعيــم الغــزي",
    "title": "الأميـن العـام لمجلـس الـوزراء",
    "date": "6/11/2024"
  },
  "extraction_notes": {
    "summarized": false,
    "truncated": false,
    "missing_information_policy": "null",
    "uses_chatbot": false,
    "uses_ollama": false,
    "uses_chromadb": false,
    "uses_postgresql": false
  }
}