{
  "schema_version": "iraqi_legal_document.v2",
  "created_at": "2026-08-15T18:18:19.004052+00:00",
  "source": {
    "filename": "قرار البنود العقدية بين شركة المنتجات النفطية وشركة كار.docx",
    "extension": ".docx",
    "parser": "legal_document_parser",
    "encoding": "utf-8"
  },
  "document": {
    "title": "قــرار مجلــس الــوزراء",
    "type": "قرار مجلس الوزراء",
    "decision_number": null,
    "year": "2024",
    "issue_date": "19/11/2024",
    "session_number": "السابعة والاربعين",
    "session_date": "19/11/2024"
  },
  "metadata": {
    "source_filename": "قرار البنود العقدية بين شركة المنتجات النفطية وشركة كار.docx",
    "source_stem": "قرار البنود العقدية بين شركة المنتجات النفطية وشركة كار",
    "title": "قــرار مجلــس الــوزراء",
    "document_type": "قرار مجلس الوزراء",
    "decision_number": null,
    "year": "2024",
    "issue_date": "19/11/2024",
    "session_number": "السابعة والاربعين",
    "session_date": "19/11/2024",
    "subject": null,
    "sender": null,
    "recipient": null,
    "signature": {
      "name": "د. حميـد نعيـم الغـزي",
      "title": "الأميـن العـام لمجلـس الـوزراء",
      "date": null
    },
    "source_character_count": 401,
    "source_paragraph_count": 8
  },
  "references": [],
  "decision": {
    "sections": [
      {
        "section_id": "header",
        "title": "header",
        "paragraph_indexes": [
          1,
          2,
          3
        ],
        "text": "قــرار\nمجلــس الــوزراء\nرقــم (                ) لسنــة 2024"
      },
      {
        "section_id": "signature",
        "title": "signature",
        "paragraph_indexes": [
          6,
          7,
          8
        ],
        "text": "د. حميـد نعيـم الغـزي\nالأميـن العـام لمجلـس الـوزراء\n/11/2024"
      }
    ],
    "numbered_items": []
  },
  "long_text": "قــرار\nمجلــس الــوزراء\nرقــم (                ) لسنــة 2024\nقـرر مجلـس الـوزراء فـي جلستـه الاعتياديـــــة السابعـــة والأربعيـن المنعقـدة فـي 19/11/2024 الموافقــــة على ما يأتــي :\nاعتماد البنود العقدية للعقد النافذ بين شركة توزيع المنتجات النفطية وشركة كار لخدمـات \nتطويــر حقـــول النفـــط والغاز دون الحاجـــة الى توقيع ملحـــق عقد .\nد. حميـد نعيـم الغـزي\nالأميـن العـام لمجلـس الـوزراء\n/11/2024",
  "body": "قــرار\nمجلــس الــوزراء\nرقــم (                ) لسنــة 2024\nقـرر مجلـس الـوزراء فـي جلستـه الاعتياديـــــة السابعـــة والأربعيـن المنعقـدة فـي 19/11/2024 الموافقــــة على ما يأتــي :\nاعتماد البنود العقدية للعقد النافذ بين شركة توزيع المنتجات النفطية وشركة كار لخدمـات \nتطويــر حقـــول النفـــط والغاز دون الحاجـــة الى توقيع ملحـــق عقد .\nد. حميـد نعيـم الغـزي\nالأميـن العـام لمجلـس الـوزراء\n/11/2024",
  "paragraphs": [
    {
      "index": 1,
      "text": "قــرار"
    },
    {
      "index": 2,
      "text": "مجلــس الــوزراء"
    },
    {
      "index": 3,
      "text": "رقــم (                ) لسنــة 2024"
    },
    {
      "index": 4,
      "text": "قـرر مجلـس الـوزراء فـي جلستـه الاعتياديـــــة السابعـــة والأربعيـن المنعقـدة فـي 19/11/2024 الموافقــــة على ما يأتــي :"
    },
    {
      "index": 5,
      "text": "اعتماد البنود العقدية للعقد النافذ بين شركة توزيع المنتجات النفطية وشركة كار لخدمـات \nتطويــر حقـــول النفـــط والغاز دون الحاجـــة الى توقيع ملحـــق عقد ."
    },
    {
      "index": 6,
      "text": "د. حميـد نعيـم الغـزي"
    },
    {
      "index": 7,
      "text": "الأميـن العـام لمجلـس الـوزراء"
    },
    {
      "index": 8,
      "text": "/11/2024"
    }
  ],
  "legal_entities": {
    "organizations": [
      "شركة توزيع المنتجات النفطية وشركة كار لخدمـات"
    ],
    "companies": [
      "شركة توزيع المنتجات النفطية وشركة كار لخدمـات تطويــر حقـــول النفـــط والغاز دون ال"
    ],
    "persons": [
      "د. حميـد نعيـم الغـزي"
    ],
    "all": [
      {
        "type": "organization",
        "name": "شركة توزيع المنتجات النفطية وشركة كار لخدمـات"
      },
      {
        "type": "company",
        "name": "شركة توزيع المنتجات النفطية وشركة كار لخدمـات تطويــر حقـــول النفـــط والغاز دون ال"
      },
      {
        "type": "person",
        "name": "د. حميـد نعيـم الغـزي"
      }
    ]
  },
  "extracted_fields": {
    "document_type": "قرار مجلس الوزراء",
    "decision_number": null,
    "year": "2024",
    "issue_date": "19/11/2024",
    "session_number": "السابعة والاربعين",
    "session_date": "19/11/2024",
    "subject": null,
    "sender": null,
    "recipient": null,
    "recommendation_numbers": [],
    "reference_numbers": [],
    "document_numbers": [],
    "numeric_values": [],
    "tables": []
  },
  "signature": {
    "name": "د. حميـد نعيـم الغـزي",
    "title": "الأميـن العـام لمجلـس الـوزراء",
    "date": null
  },
  "extraction_notes": {
    "summarized": false,
    "truncated": false,
    "missing_information_policy": "null",
    "uses_chatbot": false,
    "uses_ollama": false,
    "uses_chromadb": false,
    "uses_postgresql": false
  }
}