{
  "schema_version": "iraqi_legal_document.v2",
  "created_at": "2026-08-15T18:18:19.269076+00:00",
  "source": {
    "filename": "قرار معالجة الجرحى الفلسطينين.docx",
    "extension": ".docx",
    "parser": "legal_document_parser",
    "encoding": "utf-8"
  },
  "document": {
    "title": "قــرار مجلــس الــوزراء",
    "type": "قرار مجلس الوزراء",
    "decision_number": null,
    "year": "2024",
    "issue_date": "13/11/2024",
    "session_number": "السادسة والاربعين",
    "session_date": "12/11/2024"
  },
  "metadata": {
    "source_filename": "قرار معالجة الجرحى الفلسطينين.docx",
    "source_stem": "قرار معالجة الجرحى الفلسطينين",
    "title": "قــرار مجلــس الــوزراء",
    "document_type": "قرار مجلس الوزراء",
    "decision_number": null,
    "year": "2024",
    "issue_date": "13/11/2024",
    "session_number": "السادسة والاربعين",
    "session_date": "12/11/2024",
    "subject": null,
    "sender": null,
    "recipient": null,
    "signature": {
      "name": "د. حميـد نعيـم الغـزي",
      "title": "الأميـن العـام لمجلـس الـوزراء",
      "date": "13/11/2024"
    },
    "source_character_count": 512,
    "source_paragraph_count": 9
  },
  "references": [
    {
      "type": "reference_number",
      "text": "م.خ1/21/1148"
    }
  ],
  "decision": {
    "sections": [
      {
        "section_id": "header",
        "title": "header",
        "paragraph_indexes": [
          1,
          2,
          3
        ],
        "text": "قــرار\nمجلــس الــوزراء\nرقــم (                ) لسنــة 2024"
      },
      {
        "section_id": "signature",
        "title": "signature",
        "paragraph_indexes": [
          7,
          8,
          9
        ],
        "text": "د. حميـد نعيـم الغـزي\nالأميـن العـام لمجلـس الـوزراء\n13/11/2024"
      }
    ],
    "numbered_items": []
  },
  "long_text": "قــرار\nمجلــس الــوزراء\nرقــم (                ) لسنــة 2024\nبناءً على ما عرضتـه وزارة الخارجية بموجب كتابها المرقـــم بالعــــدد ( م.خ1/21/1148 ) المـــؤرخ في 6/10/2024.\nقـرر مجلـس الـوزراء فـي جلستـه الاعتياديـــــة السادسة والأربعين المنعقـدة فـي 12/11/2024 الموافقــــة على ما يأتي :\nاستمرار علاج الجرحى والمرضى الفلسطينيين في المستشفيات المصرية مع توفير العلاج لهم \nمن الحكومة العراقية لسهولة نقلهم إلى بلدهم بعد فتح معبر رفح وتماثلهم للشفاء .\nد. حميـد نعيـم الغـزي\nالأميـن العـام لمجلـس الـوزراء\n13/11/2024",
  "body": "قــرار\nمجلــس الــوزراء\nرقــم (                ) لسنــة 2024\nبناءً على ما عرضتـه وزارة الخارجية بموجب كتابها المرقـــم بالعــــدد ( م.خ1/21/1148 ) المـــؤرخ في 6/10/2024.\nقـرر مجلـس الـوزراء فـي جلستـه الاعتياديـــــة السادسة والأربعين المنعقـدة فـي 12/11/2024 الموافقــــة على ما يأتي :\nاستمرار علاج الجرحى والمرضى الفلسطينيين في المستشفيات المصرية مع توفير العلاج لهم \nمن الحكومة العراقية لسهولة نقلهم إلى بلدهم بعد فتح معبر رفح وتماثلهم للشفاء .\nد. حميـد نعيـم الغـزي\nالأميـن العـام لمجلـس الـوزراء\n13/11/2024",
  "paragraphs": [
    {
      "index": 1,
      "text": "قــرار"
    },
    {
      "index": 2,
      "text": "مجلــس الــوزراء"
    },
    {
      "index": 3,
      "text": "رقــم (                ) لسنــة 2024"
    },
    {
      "index": 4,
      "text": "بناءً على ما عرضتـه وزارة الخارجية بموجب كتابها المرقـــم بالعــــدد ( م.خ1/21/1148 ) المـــؤرخ في 6/10/2024."
    },
    {
      "index": 5,
      "text": "قـرر مجلـس الـوزراء فـي جلستـه الاعتياديـــــة السادسة والأربعين المنعقـدة فـي 12/11/2024 الموافقــــة على ما يأتي :"
    },
    {
      "index": 6,
      "text": "استمرار علاج الجرحى والمرضى الفلسطينيين في المستشفيات المصرية مع توفير العلاج لهم \nمن الحكومة العراقية لسهولة نقلهم إلى بلدهم بعد فتح معبر رفح وتماثلهم للشفاء ."
    },
    {
      "index": 7,
      "text": "د. حميـد نعيـم الغـزي"
    },
    {
      "index": 8,
      "text": "الأميـن العـام لمجلـس الـوزراء"
    },
    {
      "index": 9,
      "text": "13/11/2024"
    }
  ],
  "legal_entities": {
    "organizations": [
      "وزارة الخارجية"
    ],
    "companies": [],
    "persons": [
      "د. حميـد نعيـم الغـزي"
    ],
    "all": [
      {
        "type": "organization",
        "name": "وزارة الخارجية"
      },
      {
        "type": "person",
        "name": "د. حميـد نعيـم الغـزي"
      }
    ]
  },
  "extracted_fields": {
    "document_type": "قرار مجلس الوزراء",
    "decision_number": null,
    "year": "2024",
    "issue_date": "13/11/2024",
    "session_number": "السادسة والاربعين",
    "session_date": "12/11/2024",
    "subject": null,
    "sender": null,
    "recipient": null,
    "recommendation_numbers": [],
    "reference_numbers": [
      "م.خ1/21/1148"
    ],
    "document_numbers": [],
    "numeric_values": [],
    "tables": []
  },
  "signature": {
    "name": "د. حميـد نعيـم الغـزي",
    "title": "الأميـن العـام لمجلـس الـوزراء",
    "date": "13/11/2024"
  },
  "extraction_notes": {
    "summarized": false,
    "truncated": false,
    "missing_information_policy": "null",
    "uses_chatbot": false,
    "uses_ollama": false,
    "uses_chromadb": false,
    "uses_postgresql": false
  }
}